{
  "case_id": "N7-EFFECTIVE-LENGTH-GUIDED-001",
  "standard": "СП 16.13330.2017",
  "action": "effective_length_guided",
  "effective_length_route": {
    "kind": "eq138_built_up_branch_in_plane",
    "segment_length_mm": 1000.0,
    "adjacent_force_ratio_alpha": 0.0
  },
  "radius": {
    "mode": "explicit",
    "value_mm": 20.0
  },
  "limiting_slenderness": {
    "mode": "compressed_table32",
    "group_4_applies": false,
    "same_stability_case_confirmed": true,
    "axial_force_n": 100000.0,
    "stability_coefficient_phi": 0.8,
    "gross_area_mm2": 4000.0,
    "design_yield_resistance_n_mm2": 240.0,
    "working_condition_factor": 1.0,
    "table32_row": "1a"
  }
}
